{"contract_name":"snapshot_manifest","contract_version":1,"campaign_id":"campaign_alpha","revision_id":"revision_12","parent_revision":"revision_11","ordinal":12,"tree_digest":"aaaaaaaaaaaaaaaaaaaaaaaaaaaaaaaaaaaaaaaaaaaaaaaaaaaaaaaaaaaaaaaa","files":[{"relative_path":"entities/station.md","sha256":"bbbbbbbbbbbbbbbbbbbbbbbbbbbbbbbbbbbbbbbbbbbbbbbbbbbbbbbbbbbbbbbb"}],"framework_version":"0.2.0","adapter_version":"1.0.0","validation_contract_digest":"cccccccccccccccccccccccccccccccccccccccccccccccccccccccccccccccc","change_digest":"dddddddddddddddddddddddddddddddddddddddddddddddddddddddddddddddd","publication_intent":{"intent_id":"intent_alpha","intent_token":"token_alpha","classification":"matched","matching_intent_count":1},"head_expectation":{"expected_parent":"revision_11","expected_ordinal":12},"lineage_status":"verified_linear","projection_checkpoint":{"revision_id":"revision_12","projection_digest":"eeeeeeeeeeeeeeeeeeeeeeeeeeeeeeeeeeeeeeeeeeeeeeeeeeeeeeeeeeeeeeee","record_count":1},"rebuild_result":{"status":"verified","shadow_digest":"ffffffffffffffffffffffffffffffffffffffffffffffffffffffffffffffff","active_digest":"ffffffffffffffffffffffffffffffffffffffffffffffffffffffffffffffff"}}
